{
  "assessment_id": "assessment:core-definition-independent-1",
  "target_id": "core-definition",
  "capability_id": "definition_recall",
  "prompt": "State the definition and explain when it applies.",
  "rubric": {
    "criteria": [
      "states the defining property",
      "names the required conditions",
      "explains the result in the learner's own words"
    ]
  },
  "expected_evidence": ["independent attempt", "condition recall"],
  "source_refs": [
    {
      "source_id": "official-exam-outline:q1",
      "authority": "official_exam_list",
      "location": {"section": "question 1"}
    }
  ],
  "difficulty": 0.45,
  "question_version": 1,
  "rubric_version": 1,
  "spec_hash": "4eead5f3319c4d0d684b3f8dd3125be36cb1ab5f4999fccdb67309f49145449c"
}
